Status,Priority,Effort,Title,Description,Completed
,High,Low,[DOCUMENTATION] Initial README.md update,"Update the README.md file to reflect the new repository name, making sure to update all relevant links and references",true
,Medium,Medium,[DOCUMENTATION] Customize README.md,"Customize the README.md file to include project-specific information and instructions",false
new,High,Low,[TASK] Update action metadata,"Update the action metadata (action.yaml, urls in package.json, etc) to reference project-specific information",false
new,Medium,Low,[TASK] Run 'Create Labels' workflow,"Run the 'Create Labels' workflow",true
new,Medium,Low,[TASK] Review/approve dependabot PR,"Review and approve the Pull Request generated by dependabot, and merge it if everything looks good",false
new,Low,Low,[TASK] Import issues from CSV,"Import issues from the provided TODO.csv file",false
